approval_id,approval_type,source_section,source_document,document_version,decision_owner,approver,decision_date,status,conditions_or_required_changes,release_to_procurement,release_to_setup,next_review_date,notes
AP-001,Layout Signoff,01_Layouts_Floorplans,2026-04-01__Floorplan_Layouts_Index__v1.md,v1,Owner,Pending,2026-04-01,Pending,Confirm all room dimensions match latest measurement sheet,No,No,2026-04-08,Blocks furniture ordering until approved
AP-002,Interior Design Signoff,02_Interior_Design,2026-04-01__Interior_Design_Room_By_Room_Playbook__v1.md,v1,Owner,Pending,2026-04-01,Pending,Resolve all remaining TBD fields in room layout guides,No,No,2026-04-08,Must align with approved brand standards
AP-003,Brand Standards Signoff,03_Brand_Style_Themes/01_Standards_Strategy,2026-04-01__Theme_Standards_Spec__v1.md,v1,Owner,Pending,2026-04-01,In Review,Decide Secondary Bedroom #1 accent family and Den gaming scope,Yes,No,2026-04-03,May release long-lead decor once final decisions are locked
AP-004,Room Styling Signoff,03_Brand_Style_Themes/03_Execution_Staging,2026-04-01__Room_Styling_Map__v1.md,v1,Owner,Pending,2026-04-01,In Review,Validate placement constraints and decor caps for each room,Yes,No,2026-04-03,Required before staging-day scheduling
AP-005,Safety and Accessibility Signoff,04_Safety_Accessibility,2026-04-01__04_Safety_Accessibility_Tracker__v1.csv,v1,Owner,Pending,2026-04-01,Pending,Confirm life-safety devices and accessibility items are complete,No,No,2026-04-08,Hard gate before guest-ready status
AP-006,Final Property Design Release,02_Property_Design,All approved design documents,v1,Owner,Pending,2026-04-01,Pending,All AP-001 through AP-005 marked Approved with no open blockers,No,No,2026-04-10,Master release gate to Procurement and Setup
