research_id,research_topic,data_point,source,market_signal,priority,status,last_updated,owner,notes
MKT-001,Comp Set ADR,"Wkdy: $250-$325 | Wknd: $400-$575 | Peak: $850+","PRICING_BENCHMARK.md & COMP-PROP-01","Premium-lite positioning supported by 10-guest capacity ($45/guest median).",High,Completed,2026-04-03,Owner,Base rate target $210-$225 for launch phase.
MKT-002,Comp Set Occupancy,"55%-65% (Avg) | 60%-70% (4BR/Flex)","COMP-PROP-01, 02, 03","4BR/Flex conversion (Comp 2) yields 5-10% lift over 3BR baseline.",High,Completed,2026-04-03,Owner,Validates 60-65% stabilization target.
MKT-003,Seasonality,"Peak: Mar/Oct | Shoulder: Apr-Jun | Low: Jan-Feb","EVENT_PRICING_STRATEGY.md","F1/SXSW (Tier 1) drive 300%+ premiums and 4-night minimums.",High,Completed,2026-04-03,Owner,Supports 2.0x-3.5x multipliers for major event windows.
MKT-004,Booking Window,"Avg: 18-21 Days | Peak: 180-365 Days","ANALYTICS_STRATEGY.md & PRICING_ENGINE_RULES.md","Pricing triggers at 30, 14, and 7 days to maintain booking pace.",Medium,Completed,2026-04-03,Owner,Supports last-minute discounts of 15-25% for gap filling.
MKT-005,Amenity Demand,"Outdoor Lounge (+57%) | Social Hub (+50%)","AMENITY_VALUE_ANALYSIS.md","Experiential features (Patio/Social Island) drive $150+ nightly premiums.",Medium,Completed,2026-04-03,Owner,Focus on 'Social Hub' stack: 142"" Island + 468"" Patio.
MKT-006,Channel Mix,"Airbnb (65%) | VRBO (35%)","MARKETING_STRATEGY.md & PLATFORM_OPTIMIZATION.md","Dual-channel strategy recommended: Airbnb for velocity, VRBO for larger family yield.",Medium,Completed,2026-04-03,Owner,Optimize for mobile-first (Airbnb) and family-centric (VRBO) segments.
