approval_id,approval_type,evidence_path,decision_owner,approver,decision_date,status,conditions_or_required_changes,release_to_procurement,release_to_setup,next_review_date,notes
AP-001,Layout Signoff,01_Layouts_Floorplans/AP-001_Layout_Signoff_Gate.md,Design Lead,Approved,2026-04-05,Approved,Field verification completed and logged in `06_Field_Evidence_Capture/AP-001_Field_Verification_Log.csv`,No,No,2026-04-08,AP-001 closed via post-field closure addendum
AP-002,Interior Design Signoff,AP-002_Interior_Design_Signoff_Gate.md,Design Lead,Pending,2026-04-05,Blocked,Complete `06_Field_Evidence_Capture/AP-002_Room_Install_Checklist_Execution_Log.csv` and clear AP-001 dependencies,No,No,2026-04-08,Active gate report exists; TBD decision blockers closed
AP-003,Brand Standards Signoff,AP-003_Brand_Standards_Signoff_Gate.md,Brand Director,Pending,2026-04-05,Blocked,Complete brand styling execution evidence and procurement-state confirmation for locked focal items,No,No,2026-04-08,Active gate report exists; room-level brand decisions locked
AP-004,Room Styling Signoff,AP-004_Room_Styling_Signoff_Gate.md,Brand Director,Pending,2026-04-05,Blocked,Complete checklist and 5-pass styling map execution evidence,No,No,2026-04-08,Active gate report exists; execution evidence pending
AP-005,Safety and Accessibility Signoff,AP-005_Safety_Accessibility_Signoff_Gate.md,Safety Lead,Pending,2026-04-05,Blocked,Complete `06_Field_Evidence_Capture/AP-005_Safety_Execution_Log.csv` and close remaining tracker checks F.3/F.5/F.6/F.10,No,No,2026-04-08,Active gate report exists; MERV-13 policy set, execution pending
AP-006,Final Property Design Release,05_Approvals/AP-006_Final_Property_Design_Release_Gate.md,Property Launch Director,Pending,2026-04-05,Blocked,Requires AP-001 through AP-005 approved and no open critical blockers in approvals/safety/photo readiness controls,No,No,2026-04-10,Master release gate not cleared
